{
  "$schema": "../../../schemas/kit.schema.json",
  "id": "bunker",
  "name": "Bunker & Interior Kit",
  "version": "1.0.0",
  "description": "Post-apocalyptic underground bunker, tactical electronics, and heirloom interior props for The Whisper.",
  "items": [
    {
      "id": "bunker/coffee_grinder",
      "name": "František's Heirloom Coffee Grinder",
      "category": "props",
      "path": "coffee_grinder/model.glb",
      "preview": "coffee_grinder/preview.webp",
      "meta": "coffee_grinder/meta.json"
    },
    {
      "id": "bunker/terminal_2100",
      "name": "Amts-Terminal 2100 (Unit-X1)",
      "category": "electronics",
      "path": "terminal_2100/model.glb",
      "preview": "terminal_2100/preview.webp",
      "meta": "terminal_2100/meta.json"
    },
    {
      "id": "bunker/bunk_bed",
      "name": "Bunker Tier Bunk Bed",
      "category": "furniture",
      "path": "bunk_bed/model.glb",
      "preview": "bunk_bed/preview.webp",
      "meta": "bunk_bed/meta.json"
    },
    {
      "id": "bunker/metal_stool",
      "name": "Desolate Industrial Metal Stool",
      "category": "furniture",
      "path": "metal_stool/model.glb",
      "preview": "metal_stool/preview.webp",
      "meta": "metal_stool/meta.json"
    },
    {
      "id": "bunker/kerosene_lantern",
      "name": "Grandfather's Brass Kerosene Lantern",
      "category": "lighting",
      "path": "kerosene_lantern/model.glb",
      "preview": "kerosene_lantern/preview.webp",
      "meta": "kerosene_lantern/meta.json"
    },
    {
      "id": "bunker/combat_boots",
      "name": "Novotny's Laced Leather Combat Boots",
      "category": "props",
      "path": "combat_boots/model.glb",
      "preview": "combat_boots/preview.webp",
      "meta": "combat_boots/meta.json"
    },
    {
      "id": "bunker/metal_desk",
      "name": "Heavy Industrial Bunker Metal Desk",
      "category": "furniture",
      "path": "metal_desk/model.glb",
      "preview": "metal_desk/preview.webp",
      "meta": "metal_desk/meta.json"
    },
    {
      "id": "bunker/wall_shelf_supplies",
      "name": "Weathered Wall Shelf with Folded Clothes",
      "category": "furniture",
      "path": "wall_shelf_supplies/model.glb",
      "preview": "wall_shelf_supplies/preview.webp",
      "meta": "wall_shelf_supplies/meta.json"
    },
    {
      "id": "bunker/mess_tin_set",
      "name": "Bunker Camp Tableware Mess Set",
      "category": "props",
      "path": "mess_tin_set/model.glb",
      "preview": "mess_tin_set/preview.webp",
      "meta": "mess_tin_set/meta.json"
    },
    {
      "id": "bunker/hanging_towels",
      "name": "Stained Utility Towels on Wall Pegs",
      "category": "props",
      "path": "hanging_towels/model.glb",
      "preview": "hanging_towels/preview.webp",
      "meta": "hanging_towels/meta.json"
    },
    {
      "id": "bunker/worn_rug",
      "name": "Frayed Vintage Oriental Bunker Rug",
      "category": "props",
      "path": "worn_rug/model.glb",
      "preview": "worn_rug/preview.webp",
      "meta": "worn_rug/meta.json"
    }
  ],
  "author": "Small World Machine Studio",
  "license": "CC0-1.0"
}
